[
  {
    "id": "vocab_napper",
    "category": "Techniques",
    "level": "C2",
    "tags": [
      "sauces",
      "presentation",
      "basics"
    ],
    "french": "Napper",
    "english": "To coat / cover food with a thin layer of sauce",
    "japanese": "ナペする（ソースを均一に絡める・被せる）",
    "definition_fr": "(verbe) Recouvrir uniformément un aliment d'une couche de sauce nappante et brillante.",
    "is_professional": true,
    "examples": [
      {
        "fr": "Nappez délicatement le filet de poisson avec le beurre blanc réduit.",
        "en": "Gently coat the fish fillet with the reduced beurre blanc.",
        "ja": "煮詰めたブールブランソースで魚のフィレを優しくナペ（コーティング）してください。"
      }
    ]
  },
  {
    "id": "vocab_rectifier",
    "category": "Techniques",
    "level": "C2",
    "tags": [
      "seasoning",
      "precision",
      "basics"
    ],
    "french": "Rectifier",
    "english": "To adjust / correct the seasoning (salt, acid) at the final stage",
    "japanese": "ルクティフィエする / 味を調える / 最終微調整する",
    "definition_fr": "(verbe) Modifier l'assaisonnement (sel, poivre, vinaigre, etc.) d'une préparation culinaire juste avant le service pour atteindre l'équilibre parfait.",
    "is_professional": true,
    "examples": [
      {
        "fr": "Goûtez la sauce et rectifiez l'assaisonnement avec une pointe de vinaigre de xérès.",
        "en": "Taste the sauce and adjust the seasoning with a dash of sherry vinegar.",
        "ja": "ソースを試食し、シェリー酒の酢を微量加えて味をルクティフィエ（最終微調整）してください。"
      }
    ]
  },
  {
    "id": "gram_passe_simple_recettes",
    "category": "Grammar",
    "level": "C2",
    "tags": [
      "grammar"
    ],
    "grammar": {
      "topic": "The Passé Simple in Classical Recipe Literature (Le Passé Simple)",
      "explanation_ja": "現代の厨房で話されることはありませんが、オーギュスト・エスコフィエの『ル・ギド・キュリネール』のような古典的フランス料理文献を研究する際、単純過去形（Passé Simple）が非常によく使われます。",
      "explanation_en": "While not spoken in modern kitchens, the Passé Simple (historic past tense) is commonly encountered when studying classical French culinary texts, such as Auguste Escoffier's Le Guide Culinaire."
    },
    "examples": [
      {
        "fr": "Le chef prit le canard et le coupa en quatre morceaux.",
        "en": "The chef took the duck and cut it into four pieces. (Passé Simple)",
        "ja": "シェフは鴨を取り、4つに切り分けた。"
      },
      {
        "fr": "Ils ajoutèrent le vin blanc et laissèrent mijoter.",
        "en": "They added the white wine and let it simmer. (Passé Simple)",
        "ja": "彼らは白ワインを加え、弱火で煮込んだ。"
      }
    ]
  },
  {
    "id": "cuis_gastronomie_moderne",
    "category": "Theory",
    "level": "C2",
    "tags": [
      "haute-cuisine",
      "molecular",
      "philosophy"
    ],
    "cuisine": {
      "topic": "L'Évolution de la Haute Gastronomie (Modern Haute Gastronomie)",
      "content_fr": "La haute cuisine contemporaine allie la rigueur classique d'Escoffier avec les avancées de la gastronomie moléculaire. Elle met l'accent sur la pureté des saveurs, le respect saisonnier absolu et des présentations épurées et artistiques.",
      "content_en": "Contemporary haute cuisine blends the classical rigor of Escoffier with molecular gastronomy advancements. It emphasizes flavor purity, absolute seasonal respect, and minimalist artistic presentations.",
      "content_ja": "現代の高等料理（オートキュイジーヌ）は、エスコフィエの古典的厳格さと分子ガストロノミーの成果を融合させています。素材本来の風味の純粋さ、絶対的な季節感の尊重、そして極限まで洗練された芸術的プレゼンテーションに焦点を当てています。"
    }
  },
  {
    "id": "kb_cuis_guide_culinaire_escoffier",
    "category": "Theory",
    "level": "C2",
    "tags": [
      "history",
      "literature",
      "escoffier"
    ],
    "grammar": {
      "topic": "Le Passé Simple dans les Recettes Classiques (Past Simple in Classics)",
      "explanation_ja": "オーギュスト・エスコフィエの『料理の手引き』における一連の歴史的調理動作を客観的に記述するための単純過去（Passé Simple）の使い方。",
      "explanation_en": "How to read and understand the historic past tense (Passé Simple) in classic culinary literature."
    },
    "cuisine": {
      "topic": "Le Guide Culinaire d'Escoffier (Escoffier's Culinary Guide)",
      "content_fr": "Publié en 1903, 'Le Guide Culinaire' est la bible de la cuisine classique française. Les recettes y sont rédigées dans un style concis, utilisant souvent le passé simple. Par exemple : 'On assaisonna la volaille, puis on la mit au four.' La lecture de ces textes permet de comprendre la structure narrative des recettes professionnelles.",
      "content_en": "Published in 1903, 'Le Guide Culinaire' is the bible of classic French cuisine. The recipes are written in a concise style, often utilizing the passé simple. Reading these texts helps in understanding the narrative structure of professional recipes.",
      "content_ja": "1903年に出版された『ル・ギド・キュリネール（料理の手引き）』は、古典フランス料理の聖書です。レシピは簡潔なスタイルで書かれており、単純過去が頻繁に使用されます。例えば、「鶏肉に味を調え、オーブンに入れた（assaisonna / mit）」。これらの古典文献を読み解くことで、専門的な料理記述のナラティブ構造を深く理解できます。"
    },
    "examples": [
      {
        "fr": "Escoffier écrivit ce livre pour codifier la cuisine française ; il y simplifia les structures de la brigade.",
        "en": "Escoffier wrote this book to codify French cuisine; he simplified the structures of the brigade in it.",
        "ja": "エスコフィエはフランス料理を体系化するためにこの本を書きました。彼はその中でブリガード（組織）の構成を簡略化しました。"
      }
    ]
  },
  {
    "id": "gram_passe_anterieur",
    "category": "Grammar",
    "level": "C2",
    "tags": [
      "grammar"
    ],
    "grammar": {
      "topic": "Past Anterior (Le Passé Antérieur)",
      "explanation_ja": "前過去（Passé Antérieur）は、文学や歴史的文章で使われる高度な過去時制です。単純過去（Passé Simple）で表される過去の出来事より前に完了した動作を示します。形は助動詞avoirまたはêtreの単純過去＋過去分詞で作ります。現代の日常会話ではほとんど使用されませんが、古典的な料理書、歴史資料、19世紀〜20世紀初頭のガストロノミー文献を読む際に登場します。エスコフィエなどの古典的な料理文献では、工程の順序や完成までの流れを文学的に記述するために理解しておく価値があります。",
      "explanation_en": "The past anterior (Passé Antérieur) is a literary tense used mainly in historical writing, classical literature, and formal narratives. It describes an action completed before another action expressed with the passé simple. It is formed with the passé simple of avoir or être plus the past participle. Although rarely used in modern conversation, understanding this tense is useful when reading classical culinary texts, historical recipes, and gastronomic literature from earlier periods."
    },
    "examples": [
      {
        "fr": "Quand le chef eut terminé la préparation, il servit le plat aux invités.",
        "en": "When the chef had finished the preparation, he served the dish to the guests.",
        "ja": "シェフが仕込みを終えると、料理を客に提供しました。"
      },
      {
        "fr": "Après que le pâtissier eut mélangé les ingrédients, il enfourna la pâte.",
        "en": "After the pastry chef had mixed the ingredients, he put the dough in the oven.",
        "ja": "パティシエが材料を混ぜ終えた後、生地をオーブンに入れました。"
      },
      {
        "fr": "Dès que le cuisinier eut ajouté les épices, l'arôme changea complètement.",
        "en": "As soon as the cook had added the spices, the aroma changed completely.",
        "ja": "料理人がスパイスを加えるとすぐに、香りは完全に変化しました。"
      }
    ]
  },
  {
    "id": "vocab_caviardage",
    "category": "Media",
    "level": "C2",
    "tags": [
      "Nom",
      "Media"
    ],
    "french": "Caviardage",
    "english": "Redaction / Censorship",
    "japanese": "(Nom) 墨塗り、検閲",
    "definition_fr": "Terme d'apprentissage (caviardage).",
    "is_professional": false,
    "examples": [
      {
        "fr": "Utilisation pratique de caviardage.",
        "en": "Practical use of redaction / censorship.",
        "ja": "(Nom) 墨塗り、検閲の実用的な例。"
      }
    ],
    "gender": "m"
  },
  {
    "id": "vocab_chnaie",
    "category": "Nature",
    "level": "C2",
    "tags": [
      "Nom",
      "Nature"
    ],
    "french": "Chênaie",
    "english": "Oak grove",
    "japanese": "(Nom) 樫の木立",
    "definition_fr": "Terme d'apprentissage (chênaie).",
    "is_professional": false,
    "examples": [
      {
        "fr": "Utilisation pratique de chênaie.",
        "en": "Practical use of oak grove.",
        "ja": "(Nom) 樫の木立の実用的な例。"
      }
    ],
    "gender": "f"
  },
  {
    "id": "vocab_circonspection",
    "category": "Psychology",
    "level": "C2",
    "tags": [
      "Nom",
      "Psychology"
    ],
    "french": "Circonspection",
    "english": "Circumspection / Caution",
    "japanese": "(Nom) 慎重さ",
    "definition_fr": "Terme d'apprentissage (circonspection).",
    "is_professional": false,
    "examples": [
      {
        "fr": "Utilisation pratique de circonspection.",
        "en": "Practical use of circumspection / caution.",
        "ja": "(Nom) 慎重さの実用的な例。"
      }
    ],
    "gender": "f"
  },
  {
    "id": "vocab_cochenille",
    "category": "Science",
    "level": "C2",
    "tags": [
      "Nom",
      "Science"
    ],
    "french": "Cochenille",
    "english": "Cochineal",
    "japanese": "(Nom) エンジムシ",
    "definition_fr": "Terme d'apprentissage (cochenille).",
    "is_professional": false,
    "examples": [
      {
        "fr": "Utilisation pratique de cochenille.",
        "en": "Practical use of cochineal.",
        "ja": "(Nom) コチニール（エンジムシ）の実用的な例。"
      }
    ],
    "gender": "f"
  },
  {
    "id": "vocab_corrlat",
    "category": "Science",
    "level": "C2",
    "tags": [
      "Nom",
      "Science"
    ],
    "french": "Corrélat",
    "english": "Correlate",
    "japanese": "(Nom) 相関物",
    "definition_fr": "Terme d'apprentissage (corrélat).",
    "is_professional": false,
    "examples": [
      {
        "fr": "Utilisation pratique de corrélat.",
        "en": "Practical use of correlate.",
        "ja": "(Nom) 相関物の実用的な例。"
      }
    ],
    "gender": "m"
  },
  {
    "id": "vocab_couvaison",
    "category": "Science",
    "level": "C2",
    "tags": [
      "Nom",
      "Science"
    ],
    "french": "Couvaison",
    "english": "Brooding / Incubation",
    "japanese": "(Nom) 抱卵、孵化",
    "definition_fr": "Terme d'apprentissage (couvaison).",
    "is_professional": false,
    "examples": [
      {
        "fr": "Utilisation pratique de couvaison.",
        "en": "Practical use of brooding / incubation.",